,dates,rating,review,title
86,2015/08/12,3,"저녁 무렵 도착해서 다둘러보진 못했지만, 분위기는 조용하고 좋았어요.주변에 주차시설 부족으로 불편함.",나름 괜찮았어요
87,2015/08/07,5,여수에 방문하면 꼭 방문해야할 곳 중 한곳인 오동도. 오동도는 걸어서 가는 방법과 관광차로 가는 방법이 있는데 관광차로 이동하는것을 추천한다. 오동도에 들어갈때 걸어가다가 후회했음--;;. 자연경관이 이쁘고 라이브음악에 맞춰 나오는 분수쇼도 제법 볼만하다. 뛰어난 볼거리는 없지만 자연을 보러가는 곳으로 좋은 코스이다.,여수에 왔으면 필수 코스~~ 오동도
88,2015/08/05,4,"엠블호텔과 바로 인근(걸어서 5분)거리에 위치하여, 아침, 저녁으로산책하기 좋은 곳입니다.걸을면서 주변 바다를 볼수 있으니 이것도 좋은점이 겠지요..",산책하기 좋은 곳
89,2015/08/05,5,"오동도는 크지않고 높지않고 산책하기 매우 좋은 곳,신선한 회와 먹거리가 즐비한 여수,아이들 볼거리도 많고, 보트나 유람선 도 좋습니다.",환상의 동백섬
90,2017/07/06,5,"일단 전망이 너무 좋았습니다. 특히, 여수하면 오동도를 빼놓을 수 없을 정도로 유명한 관광지이기도 합니다. 무엇보다도 갈대 숲?이라고 해야하나.. 정말 사진이 잘 나옵니다. 그리고 코끼리 열차??같은 관광열차가 있기 때문에 오래 걷지 않고 편히 다녀올 수 있습니다.",바다를 한눈에 볼 수 있는 곳!
91,2017/06/27,4,오동도는 동백이 유명하다했는데우리가 방문할시에는 얼마남지 않아 아쉬웠다하지만 오동도로 들어가는 바닷길에서 바라본여수바다의 모습은 정말일품!!오동도안의 갯바위들과 등대의 경치도아름다웠으며 시간맞춰 방문하면 음악분수의 멋진쇼를 볼수있다해질녘 나오는 순간에 보이는 여수밤바다의 노을이여행의 참맛을 느끼게해주었다,산책하기 너무 좋았던 여수바다
92,2015/04/30,5,동백꽃의 고향 여수 오동도 웰빙트레킹으로 낭만의 발걸음을했다. 봄을 찾아가다~^^ 섬 전체가 한폭의 그림처럼 아름답고 한국의 아름다운 길 100선에 선정되고 운치 있는 768M의 방파재를 걸어가면 4000여 그루의 동백나무가 반깁니다. 맨발공원 시누대터널 등대전망대가 있어 검푸른 남해바다와 찾아오는 봄을 느끼며 돌산 갓김치 맛을 느끼는 한려해상국립공원에 다녀왔다. 등대 옆의 전망대는 엘리베이터가 설치되어 있어서 연로하신 분들이나 어린 아기들은 이용하기에 수월한 듯하였다. 그리고 엑시퍼 전시관에는 멋진 관람과 함께 동백꽃 벽화가 있어 포토존으로 그만이다. 또한 옆에 유람선을 타는데는 1시간 정도가 소요되고 있었으며 시간 조절을 잘 한다면 유용한 여행 팁이 될 것 같았다. 그리고 트램이 운행되고 있었는데 3량 정도 연결이 되었던 것으로 기억하는데 겨울이라 그럴지도 모른다. 성수기에는 더 많은 차량이 연결되어 운행되지 않을까? 주차장 옆 호텔 앞에는 언덕위의 케이블카를 탈 수 있는 시설이 있었다. 1인 2만원 25000원 이라는 점이 부담일 수는 있지만 여수대교까지 왕복한다고 하는데 나는 시간 때문에 언덕위에 올라가 보지를 못해서 아쉬웠다. 다행인 것은 갓김치를 3kg에 2만원씩 구입했는데 여수 재래시장에서는 1kg에 1만원씩 이었다. 3만원이니 50%나 비싼 것이었다. 여행에 참고하시면 좋을 듯하다.상호는 <뚱땡이 돌산 갓김치> 였다. 한정식도 저렴하게 팔고 있었는데 일정이 바빠 여수 수산시장으로 갔다가 다시 여수 식당으로 갔다. 여수식당의 회가 일품이었다. 아무리 배가 고팠다고 헤도 이제까지 매가 먹어본 회중 제일 맛이 있었다고 단언 할 수 있다. 싱싱하고 식감이 최고 였었다.,봄을 찾아가 만나다. 2015 여수 오동도
93,2015/04/28,4,"가볍게 산책하며 대한민국의 전라남도를 느껴보기에는 좋은 곳. 다만 인적이 드문 곳이나 바위가 있는 곳, 골짜기는 춥기도 하고 사고의 위험이 있으니 아이를 동반한 부몬느 피할 것을 권함.",가볍게 거닐기 좋은 곳.
94,2015/03/17,1,불법주차 차량과 길헤매는 수 많은 차들로 인해 언제 어디서 차에 치일지 알 수가 없고 도로는 단차가 제멋대로라 유모차가 뒤집어지는 경험을 했습니다. 유명 관광지인데 이렇게까지 개념없는 시설을 해놓고 고칠 생각도 없어보이니 도대체 누가 운영하는건지 한심합니다. 암만 경치가 좋으면 뭐하나 가다가 다치고 죽을 수 있다 싶은데... 너무 화가나서 한참을 씩씩거리다가 그냥 발을 돌려서 돌아왔습니다. 관리자라곤 60대 노인들뿐이고 그나마도 나한테 왜그러냐는 식이어서 개선의 방법이 안보입니다. 사람없을때나 모를까 주말에는 비추하고 싶어요.,"위험하고 정신없는 주차장, 뭐하자는건지"
95,2014/12/23,4,오동도가 여수에서 유명하다고 해서 데이트하러 갔었는데제가 갔을 땐 분수가 켜지지 않아서 조금 아쉬웠지만그래도 나름 재밌었습니다.여수에 들르면 한번쯤 가보아도 괜찮은 곳이에요.운동화가 필요할 것 같았어요 ㅋㅋ,시원한 바람 맞으며 산책.
96,2014/11/15,5,"매우 더운 날 가서 힘들게 갔던 기억이 나는데요, 막상 오동도에 가자 바닷바람이 시원하게 불고 풍경이 너무 아름다웠었습니다. 오동도 섬 하나가 생각보다 크기도 하고 볼 거리도 참 많았습니다. 나무들이 우거진 풍경과 넓게 펼쳐진 바다, 그리고 동굴 등 좋은 기억만 남아있는 곳입니다.",여름날의 시원한 바람이 부는 오동도
97,2014/04/28,5,"뷰 포인트까지 가서 바닷바람도 쐬고 탁 트인 바다도 구경하고 좋았습니다. 중간중간 화장실이 있는데 깨끗하게 잘 관리되어있어요.8월 초에 갔더니 날씨가 넘 더워서... 다 둘러보지는 못했는데요,, 선선할때가면 좋을 것 같습니다.",산책하기 좋은 오동도
98,2013/09/24,4,"음식점은 정말 별로였는데, 오동도자체는 볼것도 많고, 시원한곳도 많고, 사진찍을곳도 많아서 좋았어요http://sajayoon12.blog.me/30173852208",시원하고 산책하기좋았던 오동도
99,2013/08/16,5,걸어가기고 편하고 너무나 아름다운 여수 밤바다를 볼수 있고 또 등대로 오르는 길이며 멀리 보이는 바다 풍경이 너무나 아름다운 곳입니다.,가깝고 너무 좋았어요
100,2017/07/06,3,"오동도 는 아름다운 섬. 케이블카를 타고 반대편 오동도 papiolani 에서 오동도 의 아름다운 전망을 볼 수 있기 때문에. 아름다운 다리 하는 볼 수 있는 다채로운 밤에. 정원이 잘 조직. 나는 세 개의 별 을 보고 케이블카를 타고 섬을 볼 수 있기 때문에 다음 정원, 많은 아무 것도 없습니다. 또한, 한 시간 정도를 기다려야 하는 케이블 카.",좋은 정원과 아름다운 다리
101,2017/06/27,5,많은 준비를 할 수 있는. 이 섬에서 꼭 방문해야 할 경우를 대비 하는 여수 / 하이킹.,길 지원하지만 가치 / 하이킹
102,2017/05/18,3,"나는 할 수 없기 때문에 즐길 수 있는 강한 바람.
셔틀 버스 티켓을 구입하기 전에 떠날 때까지 부탁 드립니다. 30분을 기다려야 하는 때로는. 총 25분 걸리는 거리의 버스를 이용할 때.",작은 섬
103,2017/01/12,5,"일출을 보는 답변하기 좋은 곳, 좋은 사람들이 좋아하고 산을 오르기, 나무가 많아서 더 좋은 기후.",좋은 섬
104,2017/01/01,5,주위에 하이킹 하는 작은 섬은 방문 였습니다. 우리는 나무 그늘 이 아주 잘 계획 및 에 많이 뜨거운 여름 거였어요. 사랑스러운 곳!,아름다운 잘 되고 있는
105,2016/11/17,5,제가 며칠 전에 오동도 raelled. 많은 아름다운 섬입니다. 나는 친구들과 함께 방문한 이곳은 여기 ktravelbus.,여행 ktravel.
106,2016/10/17,4,"개발도 하고 섬 관광명소
버스를 타고 갈 수 있어 섬 또는 시작
등반 이 등대 는 등대 의 멋진 전망 좋은 &
오랜 산책, 섬을 구경하는 동안 잊지 말고","신선한 공기, 좋은 산책 "
107,2016/07/01,4,이 섬에서 200미터 다리 - 연결된 있어요. 전차를 타고 걸어서 수 있습니다. 팔 에 있는 음료 (커피/차) 섬.,우리는 이 섬에 있는 평화로운 산책을 즐길 수
108,2016/05/16,4,"저는 운이 좋아서 걸어서 오동도 활선. 을 원하는 관광객들과 주민들은 모두 분주한 신선한 공기와 아름다운 바다 전망을 즐기실 수 있습니다. 술을 마시고 있는 캐주얼 레스토랑 또는 맞물림연결, 기념품 가게, 보트 타기, 추적 및 표시.",좋은 산책
109,2016/03/25,5,"아름다운 섬입니다. 이 도착할 수 있는 음식, 사실. 정말 좋은 패스를 가지고 있어서 자연 파빌론의... 그리고 하이라이트는 분수 공원, 클래식 음악 유입구를! 완벽 하 picknick... 혹은 휴식을 취할 수 있는!",여수에서 가장 
110,2017/07/06,4,이 섬은 귀여운 커플을 위한 곳입니다. 작은 편이라 걸어서 몇 시간 정도. 에 있는 작은 카페에서 휴식을 취할 수 있는 술을 마시고 있을. 이 해안을 따라 멋진 사진을 찍기 좋은 곳이 있다. 작은 등대 도 있었지만 정말 가치가 최고. 짧은 기차를 타면 800 만 원. 이 섬은 정말 예쁜 것이 아니라 도보로 지하철 자랑할만한 가치가 있다.,즐거운 오후
111,2017/06/27,5,바다 풍경을 즐길 수 있는 회사입니다 하기에 만들지 수 있습니다. 또한 해산물 레스토랑을 즐길 수 있다.,아름다운
112,2016/01/01,3,"충분히 좋은 공원, 산책로 근처 섬에 잘 표시. 2 - 3시간 정도 즐길 수 있는 매우 느린 도보 여행자 한 것입니다.",몇 시간 동안 좋은 전환
113,2015/11/20,5,"오동도 참여해 오는 사람이 만든 이 섬을 피어. 이 리조트의 위치는 그 자체로, 내 검토, 다른 섬에 위치한 집중 검토 유지하기 아닌 전체적으로 개별 관광명소, 있을 것에 대해서는 각 터렛공구대이. 피어, 길이 약 킬로미터에 의해 제어할 수 있는 버스 당김기. 버스를 타고 뻗어있는 길이가 800원 성인 당 비용 절감 - 각 방법. 왕복 티켓 을 사 두 개의 단일 티켓을 구입해야 합니다. 쉽게 이동할 때 이 섬을 여행하는 중.버스에서 내려. 나는 조금 실망 에 대한 고백해야합니다. 이 저렴한 새로운 상점과 한국의 해산물 레스토랑. 어느 날 이 매력. 나는 인도 산 정상으로 가파른 섬에 있는, 조용하고 그늘진 곳이 갑자기 한 매력을. 나는 주 까지 걸어갈 수 있는 언덕 위의 등대 에 도달. 좋은 전망을 볼 수 있는 등대 의 모든 방향으로. 꼭대기 층에 있는 등대 로 통하는 창문은 방풍 낙심 갤러리 보기 보게. 표시할 수 있는 엘리베이터를 이용하여 갤러리 왼쪽에 있는 장소입니다.저는 커피숍에 등대 맞은 편. 어떤 맛이 나는 커피 이었지만 즐거운 커피 같은 아무것도 주문 했다. 야외 좌석 공간은 꽤 조용한 배경 음악을 하고 있는 조용한 클래식 피아노와 가게. 매우 편안하고 평화로운 곳입니다. 저는 거의 한 시간에 그늘에 신선한 바람을 즐기며 음악을 듣고 하는 섬.나는 다양한 파헤치 관광, 바다 뷰를 제공하나. 결국 방향 버스를 산책하고 와. 하지만 이는 매우 즐거운 풍경의 원형 보도 한 바다 처럼. 섬 이라는 주장이 아닙니다 나타나는 트리의 형성. 나무가 아니라고 - 재미있는 저와 닮은 점 몇 가집니다 테스트할 목적으로 인텔사에서 제공합니다. 저는 기억에 더 아름다운 풍경을 즐길 수 있는 커피숍 맨 위에 언산. 몇 시간 동안의 방문할만한 가치가 있다, 하는 것을 훨씬 덜 바쁜 평일에 방문할 때도 주말에 섬.메모, app '지도나' 작동하지 않는 섬상의 주 파헤치, 주어진 섬이 너무 작지 이 정말 문제가 없지만. 나는 내 자신의 음료나 음식을 하고 싶다면 더 머물게 하지 않는 한국 요리 감사합니다. 그럼에도 불구하고, 커피샵의 가치가 있는 언덕 위의 징조 는 휴식과 명상 하는 것도 잠시.",멋진 전망과 조용한 섬 - 리조트 자체는 위치
114,2015/09/11,5,좋은 무료 옵션 - 10분 호텔 (MVL) 에서 - 진정 좋은 곳에서 휴식을 원한다면 시티 - 실제로 매우 가깝지만 먼 느낌.,간편한 액세스 - 매우 즐거운 곳이 바로 나가고
115,2015/08/06,4,"당신의 경험 많은 사람이 거기 방법에 따라 달라집니다. 아주 관광, 그리고 아름다운. 저는 음력설 에 었는데 정말 점심, 였지만 경치는 멋진 관계.",아름다운 섬
116,2015/03/27,5,"너무 늦은 후기. 놀라운 점은 언덕 꼭대기. 확실히 가치 있는 거리. 또한 등대 에 여행, 은 어서 처음 보는 등대. 놀라운 경험.",제 1의 국가 여행
